"""Your time is limited, so don't waste it living someone else's life. Don't be trapped by dogma – which is living with the results of other people's thinking.""",Non-Limerick
"""The future belongs to those who believe in the beauty of their dreams.""",Non-Limerick
"""If you look at what you have in life, you'll always have more. If you look at what you don't have in life, you'll never have enough.""",Non-Limerick
"""If you set your goals ridiculously high and it's a failure, you will fail above everyone else's success""",Non-Limerick
"""You may say I'm a dreamer, but I'm not the only one. I hope someday you'll join us. And the world will live as one.""",Non-Limerick
"""You must be the change you wish to see in the world.""",Non-Limerick
"""Spread love everywhere you go. Let no one ever come to you without leaving happier.""",Non-Limerick
"""The only thing we have to fear is fear itself.""",Non-Limerick
"The ad said, for one little fee,
You can skip all that course-work advice.
So send your tuition,
For boundless fruition!
Get your mail-order physics degree!",Non-Limerick
"Your units are wrong! cried the guide.
Your church weighs six joules — what a feature!
And the people inside
Are four hours wide,
And eight gauss away from the preacher!",Non-Limerick
"The lemmings get set for their run.
With one step and two steps they pace.
They take three and four,
And then head on for more, 
Without checking the limiting case.",Non-Limerick
"To figure the inches you’ve run,
Or to find the slug mass of the sun,
Forget your aversion
To unit conversion.
Just multiply (wisely!) by two.",Non-Limerick
"The skill to do math on a board
Has declined to the point of outrage.
Equations quadratica
Are solved on Math'matica,
And on birthdays we don't know our age.",Non-Limerick
"How Fermi could estimate stuff!
Like the well-known Olympic ten rings,
And the one-hundred states,
And weeks with ten dates,
And birds that all fly with one... wings.",Non-Limerick
"For things moving free or at rest,
Observe what the first law does best.
It defines a key frame,
Inertial by name,
Where the second law then is shown.",Non-Limerick
"It may seem, with the angst it can bring,
That an Atwood's machine's a harsh thing.
But you just need to tell
That F is ma,
And use conservation of string!",Non-Limerick
"What would you have thought, Galileo,
If instead you dropped cows and did say, ""Oh!
To lessen the noise
Of the moos from the ground,
They should fall not through air but through mayo!""",Non-Limerick
"If a monkey lets go of a tree,
The arrow will hit him, you see,
Because both heights are pared
By a half gt cubed
From what they would be with no g.",Non-Limerick
"""To three, five, and seven, assign
A name,"" the prof said, ""we'll define.""
But he botched the rule
With woeful induction,
And told us the next prime was nine.",Non-Limerick
"In Boston, lived Jack, as did Jill,
Who gained mgh on a mountain.
In their liquid pursuit, 
Jill exclaimed with a hoot,
""I think we've just climbed a landfill!""",Non-Limerick
"While noting, ""Oh, this is just grand,""
Jack tripped on some trash in the mud.
He changed his potential
To kinetic, torrential,
But not before grabbing Jill's hand.",Non-Limerick
"Newton said as he gazed off afar,
""From here to the most distant planet,
These wond'rous ellipses
And solar eclipses
All come from a 1 over r.""",Non-Limerick